{
  "$comment": "Requirement IDs: HEE-EVAL-01 | Owned by DP-W08 | Example report over 3 iterations, iteration 2 not kept (hashes illustrative).",
  "version": "1.0.0",
  "generated_at": "2026-10-04T12:10:00.000Z",
  "product": "Shelf demo",
  "scenarios_hash": "0123456789abcdef0123456789abcdef0123456789abcdef0123456789abcdef",
  "tasks": 2,
  "repetitions": 2,
  "model": "gemini-3.0-flash",
  "chosen_iteration": 3,
  "control_iteration": 1,
  "comparable": true,
  "comparable_reasons": [],
  "treatment": {
    "runs": 4,
    "passed": 4,
    "pass_rate": 100,
    "first_pass_valid_rate": 1,
    "failed_calls": 0,
    "retries": 0,
    "tokens_per_run": 30,
    "wall_s_per_run": 0.1,
    "safety_violations": 0,
    "calls_per_run": 2
  },
  "control": {
    "runs": 4,
    "passed": 1,
    "pass_rate": 25,
    "first_pass_valid_rate": 0.9,
    "failed_calls": 1,
    "retries": 0,
    "tokens_per_run": 60,
    "wall_s_per_run": 0.4,
    "safety_violations": 0,
    "calls_per_run": 4
  },
  "per_task": [
    {
      "task_id": "t01",
      "title": "Blue widget to shelf B",
      "treatment": { "passed": 2, "runs": 2 },
      "control": { "passed": 1, "runs": 2 }
    },
    {
      "task_id": "t02",
      "title": "Red widget to shelf B",
      "treatment": { "passed": 2, "runs": 2 },
      "control": { "passed": 0, "runs": 2 }
    }
  ],
  "iterations": [
    {
      "n": 1,
      "aspect": "baseline",
      "note": "",
      "pass_rate": 75,
      "first_pass_valid_rate": 0.95,
      "tokens_per_run": 32,
      "wall_s_per_run": 0.2,
      "safety_violations": 0,
      "kept": true
    },
    {
      "n": 2,
      "aspect": "descriptions",
      "note": "clearer descriptions",
      "pass_rate": 75,
      "first_pass_valid_rate": 0.95,
      "tokens_per_run": 31,
      "wall_s_per_run": 0.2,
      "safety_violations": 0,
      "kept": false
    },
    {
      "n": 3,
      "aspect": "schemas",
      "note": "tighter schemas",
      "pass_rate": 100,
      "first_pass_valid_rate": 1,
      "tokens_per_run": 30,
      "wall_s_per_run": 0.1,
      "safety_violations": 0,
      "kept": true
    }
  ],
  "sessions_used": 24,
  "sessions_cap": 300,
  "replayed": false,
  "headline": "100.0% task success (4/4) with the product's action surface against 25.0% (1/4) with generic screen actions only; 30 tokens and 0.1 s per try with the surface.",
  "ceiling": "Measured on 2 frozen tasks, 2 repetitions each, with gemini-3.0-flash; this shows success on those tasks only.",
  "caveats": []
}
